{
  "log_id": "01ARZ3NDEKTSV4RRFFQ69G5FEV",
  "task_id": "01ARZ3NDEKTSV4RRFFQ69G5FCV",
  "project_id": "01ARZ3NDEKTSV4RRFFQ69G5FAV",
  "author_person_id": "01ARZ3NDEKTSV4RRFFQ69G5FDV",
  "date": "2026-04-18",
  "content": "설문 문항 초안 3차 검토. 응답자 5명 파일럿 결과 반영하여 7문항 수정. 내일 PI 확인 예정.",
  "tags": ["DONE", "REV"],
  "hours_spent": 4.5
}
